Name,Industries,Full Description,Description,Top 5 Investors,Last Funding Type,Last Funding Amount,Number of Employees,Headquarters Location,Founded Date
11x,"Artificial Intelligence (AI), Information Technology","11x develops autonomous digital workers to help organizations optimize their processes. The company focuses on simplifying go-to-market (GTM) operations by automating specific roles, allowing businesses to save on hiring budgets. Its primary products include Alice, an AI-powered sales development representative, and Jordan.",11x develops autonomous digital workers to help organizations optimize their processes.,"Abstract Ventures, Quiet Capital",Series A,"$24,000,000",11-50,"London, England, United Kingdom",Sep 2022
Tennr,"Artificial Intelligence (AI), Health Care","Tennr is a healthcare AI startup that optimizes healthcare operations by automating back-office tasks. The company leverages AI technology to replace traditional faxing systems and streamline communication processes in healthcare, ensuring patients receive timely care.",Tennr is a healthcare AI startup that optimizes healthcare operations by automating back-office tasks.,"Andreessen Horowitz, Y Combinator",Series A,"$18,000,000",11-50,"New York, New York, United States",2021
Sahara AI,"Artificial Intelligence (AI), Blockchain","Sahara AI is a decentralized AI network that enables freely and securely deploying autonomous AI with a high-performance, privacy-first network. Its collaboration network helps individuals and businesses deploy personalized, autonomous AI. It also offers a permissionless and privacy-centric network that allows cross-agent communication, knowledge transfer, and capitalization between individuals.","Sahara AI is a decentralized AI network that enables freely and securely deploy autonomous AI with high-performance, privacy-first network.","Alumni Ventures, Polychain, Sequoia Capital",Series A,"$37,000,000",11-50,"Los Angeles, California, United States",2023
HeyGen,"Generative AI, Software, Web Apps","Movio is bringing the futurist way of creating videos - by turning your text into realistic spokesperson videos in minutes, right from you broswer. No actors, cameras or editing needed. All you need is your story to tell.","Next-gen generative AI video platform with customizable AI avatars, right from your browser","Thrive Capital, Benchmark, Bond",Series A,"$60,000,000",11-50,"Los Angeles, California, United States",Nov 2020
Nurix AI,"Artificial Intelligence (AI), Data Integration",Nurix AI promotes data quality and integrity to provide accurate generative AI solutions.,Nurix AI promotes data quality and integrity to provide accurate generative AI solutions.,"General Catalyst, Accel, Meraki Labs",Series A,"$15,000,000",11-50,"Bengaluru, Karnataka, India",2024
e6data,"Analytics, Big Data, Cloud Computing","e6data develops a high-performance lakehouse compute engine designed for enterprise-level data analytics. By boosting the ROI on current platforms and architectures, e6data enables businesses to avoid ecosystem lock-in. Their next-generation SQL engine delivers five times the performance, reduces Total Cost of Ownership by 50%, and ensures smooth adoption. The solution integrates effortlessly with leading data lakehouse formats, data catalogs, governance frameworks, SQL standards, dialects, object stores, and major cloud providers.",e6data develops Lakehouse compute engines designed for enterprise-level data analytics.,"Accel, Founder Bank Capital, BEENEXT",Series A,"$10,000,000",11-50,"College Station, Texas, United States",Sep 2020
Ideogram,"Artificial Intelligence (AI), Generative AI",Ideogram is an artificial intelligence startup that provides generative text-to-image technology.,Ideogram is an artificial intelligence startup that provides generative text-to-image technology.,"Andreessen Horowitz, Index Ventures",Series A,"CA$80,000,000",1-10,"Toronto, Ontario, Canada",2022
Anysphere,"Artificial Intelligence (AI), Machine Learning",Anysphere is a company that builds Artificial Intelligence tools and assistants to help humans.,Anysphere is a company that builds Artificial Intelligence tools and assistants to help humans.,"Andreessen Horowitz, Thrive Capital",Series A,"$60,000,000",1-10,"Buffalo, New York, United States","Jan 6, 2022"
Skild AI,"Artificial Intelligence (AI), Information Technology",Skild AI is a startup that develops software to power various robots including ones with two or four legs.,Skild AI is a startup that develops software to power various robots.,"Amazon, SoftBank, General Catalyst",Series A,"$300,000,000",11-50,"Pittsburgh, Pennsylvania, United States",2023
Farcaster,"Blockchain, E-Commerce, Information Technology","Farcaster is a social network that helps coders, fitness enthusiasts, and meme makers find people based on their interests. The company focuses on increasing daily active users and adding developer primitives to the protocol, such as channels and direct message delivery. It aims to create a decentralized social network that allows users to communicate directly without the need for intermediaries.","Farcaster is a social network that helps coders, fitness enthusiasts, and meme makers find people based on their interests.","Andreessen Horowitz, First Round Capital",Series A,"$150,000,000",1-10,"Los Angeles, California, United States",2020
Viggle AI,Artificial Intelligence (AI),Viggle AI is a pioneering Canadian firm that uses artificial intelligence to enable people of all skill levels to easily create high-quality animated video using simple text instructions.,Viggle AI is a Canadian startup that uses generative artificial intelligence to revolutionize character animation.,"Andreessen Horowitz, Two Small Fish Ventures",Series A,"CA$26,000,000",11-50,"Toronto, Ontario, Canada",2022
Napkin AI,"Generative AI, Graphic Design","Napkin empowers anyone to communicate their ideas visually. With Napkin, you can transform written content into customizable visuals that can be used across Google Docs, Slides, Canva, Slack, Word, PowerPoint, Email, Text, and more. Founded by Pramod Sharma and Jerome Scholler, the creators of AI gaming company Osmo, Napkin emerged from their frustration with lengthy documents and lackluster presentations despite making learning fun for millions of kids. Experiencing firsthand the power of compelling visuals, they founded Napkin to make it easy for anyone to level-up their business communication through compelling visual storytelling. Try it out at napkin.ai","Visual AI for business storytelling. Napkin transforms your text into visuals, perfect for presentations, blogs and more.","Accel, CRV",Seed,"$10,000,000",1-10,"Los Altos, California, United States",Oct 2021
Caldera,"Blockchain, Information Technology","Caldera offers a no-code Web3 infrastructure platform to help developers spin up layer-2 blockchains. It allows users to create, launch, and manage customizable blockchain rollups. It also provides customizable fee structures, or the removal of transaction fees entirely, generating project revenue via transaction, bridge fees, or MEV, and adding support for other programming languages.",Caldera offers a no-code Web3 infrastructure platform to help developers spin up layer-2 blockchains.,"Sequoia Capital, Founders Fund",Series A,"$15,000,000",11-50,"San Francisco, California, United States",Mar 2022
Decagon,"Artificial Intelligence (AI), Software",Decagon creates generative AI for building customer service agents that work much more like humans and its platform gives customer support team leaders more visibility into their automated customer experience operations,Decagon creates generative AI for building customer service agents that work much more like humans.,"Andreessen Horowitz, Accel, Jack Altman",Series A,"$30,000,000",11-50,"San Francisco, California, United States",2023
Factory,"Artificial Intelligence (AI), Developer Tools","Factory is a developer of an AI-based platform for computer codes and software engineering. Its platform reviews code, addresses bugs, answers questions independently, and handles routine tasks like code review, debugging, and refactoring for engineers to delegate tasks and focus on tough questions.",Factory specializes in creating an AI-driven platform designed to streamline computer coding and software engineering processes.,"Sequoia Capital, MANTIS Venture Capital",Series A,"$15,000,000",11-50,"San Francisco, California, United States",Apr 2023
Black Forest Labs,"Artificial Intelligence (AI), Media and Entertainment","Black Forest Labs creates advanced generative deep learning models for images and videos. They focus on making these technologies widely accessible and transparent, ensuring that their innovations are easy to use and understand. This approach aims to democratize access to cutting-edge technology and foster greater trust and utility.","Black Forest Labs develops advanced generative deep learning models for images and videos, emphasizing broad accessibility and transparency.","Andreessen Horowitz, General Catalyst",Seed,"€28,000,000",11-50,"Freiburg Im Breisgau, Baden-Wurttemberg",2024
Leya,"Artificial Intelligence (AI), Legal","Leya is a legal technology company that develops an artificial intelligence assistant for legal professionals. Its platform offers reliable, referenced responses by integrating internal knowledge databases and external laws, cases, and regulations. It integrates with law firms’ documents, playbooks, templates, and external legal sources and assists lawyers with specific tasks related to reviewing, searching, and drafting, such as filling in transaction checklists, creating key terms reports, and writing memos to name a few.",Leya is a legal technology company that develops an artificial intelligence assistant for legal professionals.,"Y Combinator, Benchmark, Redpoint",Series A,"$25,000,000",11-50,"Stockholm, Stockholms Lan, Sweden",2023
Civitai,"Artificial Intelligence (AI), Consumer Software","Civitai is a community platform dedicated to fine-tuning open-source AI models like Stable Diffusion. Headquartered in Boise, Idaho, United States, Civitai was founded in 2023.",Civitai is a community platform dedicated to fine-tuning open-source AI models like Stable Diffusion.,Andreessen Horowitz,Seed,"$5,100,000",11-50,"San Francisco, California, United States","Jan 6, 2023"
Hippocratic AI,"Artificial Intelligence (AI), Generative AI","Hippocratic AI develops safety-focused large language models with a focus on non-diagnostic, patient-facing applications. The majority of language models undergo pre-training using the common crawl of the Internet, which might contain inaccurate and deceptive information. In contrast, Hippocratic AI is significantly prioritizing the acquisition of evidence-based healthcare content through legal means, setting it apart from these language models.","Hippocratic AI aims to develop the first Large Language Model (LLM) specifically designed for healthcare, prioritizing safety and accuracy.","Andreessen Horowitz, General Catalyst",Series A,"$17,000,000",11-50,"Palo Alto, California, United States",2022
knownwell,"Health Care, Medical, Primary and Urgent Care","Knownwell is a weight-inclusive healthcare clinic operator that aims to give people patient-centered and expert-led care. The platform of the company focuses on providing care that addresses the physical, mental, and emotional aspects of weight loss and offers a variety of services such as metabolic health services, comprehensive primary care, nutrition counseling, and behavioral health services to help patients achieve their health goals.",Knownwell is a weight-inclusive healthcare clinic operator that aims to serve patients.,"Andreessen Horowitz, Flare Capital Partners",Series A,"$20,000,000",11-50,"Needham, Massachusetts, United States",2022
Veri,"Apps, Consumer, Health Care",Veri helps health-conscious individuals achieve optimal metabolic health through a blood sugar sensor and an iOS app.,"Veri we help health-concious individuals improve their metabolic health by helping them understand what, when and how to eat.","Accel, Lifeline Ventures, PROfounders Capital",Series A,"€7,500,000",11-50,"Helsinki, Southern Finland, Finland","Feb 1, 2020"
Foundry,"Artificial Intelligence (AI), Cloud Computing","Foundry is a public cloud supported by an orchestration platform designed to simplify the utilization of AI computing resources. Foundry addresses fundamental economic and technical obstacles encountered in AI and deep learning. Current challenges faced by businesses, such as the notable GPU scarcity and inefficient use of computing capabilities, hinder their effective utilization of resources. Foundry employs pioneering approaches to overcome these hurdles, offering scalable GPU instances with unparalleled price-performance ratios.",Foundry is a public cloud supported by an orchestration platform designed to simplify the utilization of AI computing resources.,"Sequoia Capital, Lightspeed Venture Partners",Series A,"$80,000,000",11-50,"Palo Alto, California, United States",2022
Doppel,"Artificial Intelligence (AI), Cyber Security","Doppel serves a critical business function for protecting clients' brand and their customers. Their platform has given corporate partners peace of mind by scanning millions of domains, social media accounts, mobile apps, and more for phishing, account takeovers, and other digital threats. Doppel's AI models allow them to classify threats accurately and in real-time -- leading to faster takedowns. Doppel was established in 2022.","Doppel is the modern digital risk protection platform. It protects brands against phishing, account takeovers, and other digital threats.","Andreessen Horowitz, Quiet Capital",Series A,"$18,849,952",11-50,"Covina, California, United States",2022
Sema4.ai,"Artificial Intelligence (AI), Software",Sema4.ai's mission is to define the future of knowledge work by creating intelligent agents that alter how knowledge workers interact with AI.,Sema4.ai's mission is to define the future of knowledge work by creating intelligent agents that alter how humans engage with AI.,"Benchmark, Mayfield Fund, Canvas Ventures",Series A,"$30,500,000",11-50,"Atlanta, Georgia, United States",2024
Dust,"Artificial Intelligence (AI), Natural Language Processing","Dust is a company that provides an AI platform for businesses to build and deploy customized virtual assistants tailored to their specific needs. The platform enables companies to keep internal content and knowledge up-to-date, enhance collaboration and onboarding across teams, and accelerate workflows in areas like marketing, sales, data analysis, and engineering. Dust's AI-powered assistants help companies leverage their existing data and expertise to drive efficiency and productivity.",Dust is a modular technology platform that builds customized AI assistance to enhance and optimize workflows.,"Sequoia Capital, Tiny VC, Seedcamp",Series A,"€15,000,000",1-10,"Paris, Ile-de-France, France",2023
Udio,"Artificial Intelligence (AI), Information Technology",Udio is an AI-powered music creation app that offers a platform for instant music creation.,Udio is an AI-powered music creation app that offers a platform for instant music creation.,"Andreessen Horowitz, UnitedMasters",Seed,"$10,000,000",1-10,"New York, New York, United States",2023
Tacto,"Artificial Intelligence (AI), Enterprise Software","Tacto revolutionizes procurement with its cloud-based software, building future-proof supply chains for industrial organizations. As the central hub connecting these organizations with their supplier base, Tacto streamlines procurement processes, ensures compliant supply chains and enables efficient material sourcing at optimal conditions. Automating manual processes, Tacto's platform ensures regulatory compliance with supply chain acts. Its AI identifies cost-saving opportunities by analyzing price fluctuations in key cost drivers and comparing them to actual procurement spend. Navigating the supplier landscape can be a daunting task, particularly for industrial SMEs. Tacto eliminates the challenges by empowering our customers to move away from outdated methods like email and spreadsheets. The intelligent platform provides a seamless and transparent experience, simplifying all aspects of supplier management - digital, efficient & sustainable.","Tacto optimizes procurement, ensuring compliance, sustainability, and efficient material sourcing for mid-sized industrial firms.","Sequoia Capital, Index Ventures",Series A,"€50,000,000",11-50,"Munich, Bayern, Germany","Jan 1, 2020"
Eclipse,"Blockchain, Ethereum","Eclipse is building Ethereum's first Solana Virtual Machine Layer 2. While other L2 networks on Ethereum focus on providing Ethereum Virtual Machine (EVM) compatibility, Eclipse leans into performance improvements developed by the Solana Layer 1 and adds additional verification features to deploy the blockchain as a rollup. The Eclipse team includes veterans from dYdX, Uniswap, Citadel, and Airbnb. Eclipse Labs is backed by top investors including Polychain, Placeholder, and DBA.","Eclipse is Ethereum's fastest L2, powered by the Solana Virtual Machine.","Apollo, Polychain, OKX Ventures",Series A,"$50,000,000",11-50,"San Francisco, California, United States",Sep 2022
Syrup Tech,"Artificial Intelligence (AI), E-Commerce","Syrup Tech is a machine-learning decision-support engine for inventory in commerce. The company uses advanced demand forecasting and stochastic optimizations. Syrup Tech's software empowers brands and retailers to significantly increase full-priced inventory sell-through by (1) preventing stock-outs and end-of-season markdowns, (2) decrease unnecessary excess inventory and reduce overproduction, and (3) reduce the time spent on manual tasks for stretched merchandising and planning teams.","Predictive software for inventory decision-making in commerce, powered by AI/ML.","Accel, Gradient, 1984 Ventures",Series A,"$17,800,000",11-50,"New York, New York, United States","Jul 9, 2020"
Black Ore Technologies,"Artificial Intelligence (AI), Finance","Black Ore Technologies is an AI-driven financial services company. It develops and creates an AI product called Tax Autopilot, that offers end-to-end 1040 tax prep automation for CPAs and tax firms. Black Ore Technologies was founded in 2022 and is based in Texas, USA.",Black Ore Technologies is an AI-driven financial services company.,"Khosla Ventures, Andreessen Horowitz",Seed,"$60,000,000",11-50,"Austin, Texas, United States",2022
LogX,"Decentralized Finance (DeFi)","About LogX LogX is the leading Perpetual DEX on Layer 2 networks. Supported by top-tier investors like Sequoia Capital Coinbase Ventures IOSG Hashed and more LogX combines a simple user friendly interface with extremely fast order matching built on proprietary scalable infrastructure. Currently live on 15+ networks LogX stands out as the most omnipresent Perp DEX in the market. We offer two distinct products to cater to different types of traders 1. LogX Pro: An advanced order book-based platform designed for experienced traders, live on three networks. 2. LogX OG: Featuring an innovative AMM based DAMN pool infrastructure, built for scalability and live on over 10 networks, perfect for new traders. Our Competitive Edge and Uniqueness: - Low Cost High Liquidity Offering: LogX sets a new standard in decentralized trading with unmatched cost efficiency and high liquidity across multiple pairs. - Technological Superiority: Our DAMN-based AMM pool enables rapid deployment of perpetual DEXs on new networks and ecosystems. - AI-Based Trading Bots: We are the first in the perps industry to offer fully functional AI trading bots executing strategies like grid trading. At LogX we prioritize composability seamlessly integrating with other protocols while allowing other protocols to integrate with us. This makes LogX a versatile choice for applications like wallets copy trading platforms and analytics platforms.",LogX is a leading Perpetuals DEX on Layer 2 Networks. Backed by investors like Coinbase Ventures Sequoia Capital Hashed EM and more!,"Gate.io, CoinSwitch, Sequoia Capital",Seed,"$4,000,000",11-50,"Bengaluru, Karnataka, India","Nov 11, 2021"
Adaptive Real Estate,"Construction, Financial Services",Adaptive Real Estate helps construction teams save time and money. Lots of it.,Adaptive Real Estate helps construction teams save time and money.,"Andreessen Horowitz, Emergence",Series A,"$19,000,000",1-10,"New York, New York, United States",2021
Blockaid,"Blockchain, Network Security","Blockaid enable builders to protect users from fraud, phishing and hacks.","Blockaid enable builders to protect users from fraud, phishing and hacks.","Sequoia Capital, Ribbit Capital",Series A,"$33,000,000",11-50,"Tel Aviv-jaffa, Tel Aviv, Israel",2022
nsave,"Banking, Financial Services, FinTech","nsave provides offshore saving accounts for the middle-class in distressed economies. Think countries with high inflation, banks that cap withdrawals, no trust in banks, or no financial services like insurance and investments. By leveraging emerging technologies, Swiss financial infrastructure, and its recent regulatory changes, Masref provides the middle class in these countries with what they never had – a safe place to store their savings. Masref will first provide simple saving accounts, before offering other financial services.","nsave is a digital banking services platform that offers a secure and safe way to save in USD, EUR, GBP, or other currencies.","Sequoia Capital, Y Combinator",Seed,"$4,000,000",1-10,"Oxford, Oxfordshire, United Kingdom",Sep 2022
Summer Health,"Health Care, Home Health Care","Summer Health is the first step and ongoing tool for anyone navigating health concerns, offering timely text access to high-quality healthcare professionals who provide expert answers and reliable advice over text.",Summer Health is a pediatric telehealth startup.,"Sequoia Capital, Lux Capital, BoxGroup",Series A,"$11,650,000",1-10,"New York, New York, United States",2022
Allium,"Analytics, Blockchain, Cryptocurrency","Allium offers on-chain data infrastructure solutions, including managed blockchain databases and enriched data schemas. The platform supports over 40 blockchains and provides real-time alerting capabilities for various applications. Allium enables users to perform complex queries efficiently, enhancing data exploration and integration into existing workflows.",Allium is a data platform that develops applications and analyzes blockchain activities.,"Kleiner Perkins, Theory Ventures",Series A,"$16,500,000",11-50,"New York, New York, United States","Apr 21, 2021"
Privy,"Cyber Security, Developer APIs","Privy creates authentication, authorization, and data control tooling to enable developers to create products that keep users safe. It creates simple, powerful APIs for managing user data, allowing them to easily integrate user data into their products. Privy bridges the gap between users' on-chain activity and their off-chain data, allowing users to create delightful experiences without putting themselves or the product at risk.",Simple APIs to help developers manage user data privately in Web3,"Sequoia Capital, BlueYard Capital",Series A,"$18,000,000",11-50,"New York, New York, United States",2021
XFactor,"Analytics, Artificial Intelligence (AI)","XFactor is a corporate decision platform developer that uses artificial intelligence to assist with planning and strategy. The corporate platform syncs trillions of data points by combining historical and real-time key indicators from both internal and external sources in relevant marketplaces, allowing organizations to analyze sales success in real time continuously.",XFactor is a developer of a corporate decision platform that uses artificial intelligence to assist with planning and strategy.,"Accel, Lightspeed Venture Partners",Series A,"$16,000,000",11-50,"San Francisco, California, United States",2022
Rainforest,"Financial Services, FinTech, Payments","Rainforest focuses on providing software platforms for payment processing. Rainforest is headquartered in Atlanta, United States.",Rainforest focuses on providing software platforms for payment processing.,"Accel, Matrix, BoxGroup, Silicon Valley Bank",Series A,"$20,000,000",11-50,"Atlanta, Georgia, United States",Jan 2022
Valar Labs,"Artificial Intelligence (AI), Health Care","Valar Labs offers assistance services for cancer treatment through Artificial Intelligence. Founded by Anirudh Joshi, Viswesh Krishna, Pranav Rajpurkar, and Damir Vrabac in 2021, Valar Labs unlocks the potential of imaging data that is already part of routine clinical care to help guide oncologists with treatment decisions.",Valar Labs offers assistance services for cancer treatment through Artificial Intelligence.,"Andreessen Horowitz, Pear VC",Series A,"$22,000,000",1-10,"Palo Alto, California, United States",2021
Enterpret,"Analytics, Artificial Intelligence (AI)","Enterpret allows the companies to analyze their customer's feedback and help them build new products. The company was founded in 2020 by Varun Sharma and Arnav Sharma and is headquartered in San Francisco, California, United States.",Enterpret allows the companies to analyze their customer's feedback and help them build new products.,"Kleiner Perkins, Peak XV Partners",Seed,"$4,300,000",11-50,"San Francisco, California, United States",2020
Kaedim,"3D Technology, Artificial Intelligence (AI)","Whether you're creating VR games or 3D art, Kaedim can generate high-quality 3D models for you. Kaedim allows people to create 3D art with only an image.",AI for turning 2D images into 3D models,"Andreessen Horowitz, Pioneer Fund",Series A,"$15,000,000",11-50,"London, England, United Kingdom","Feb 10, 2020"
