Name,Industries,Full Description,Description,Top 5 Investors,Last Funding Type,Last Funding Amount,Number of Employees,Headquarters Location,Founded Date
Fibr,"A/B Testing, Artificial Intelligence (AI)","Fibr is a cutting-edge AI-powered platform designed to tackle the escalating challenge of customer acquisition costs (CAC) in a rapidly evolving digital landscape. As third-party cookies are phased out and privacy regulations become more stringent, traditional marketing methods are increasingly insufficient for driving down CAC and maximizing ROI. Fibr addresses this issue with its advanced personalization solutions, which enhance the effectiveness of every marketing interaction. The company's Web Pilot is an innovative tool that generates personalized, landing pages for every ad, email, and communication. This technology ensures that each user interaction is tailored to individual preferences and behaviors, significantly improving engagement and conversion rates. By providing a personalized experience across all touchpoints, Fibr helps businesses optimize their marketing spend and reduce CAC effectively. Complementing Web Pilot is Fibr’s AI Blocks, which simplifies adapting and repurposing successful content across different formats and channels. This tool ensures that marketing messages remain relevant and compelling, whether used in ads, social media posts, or emails. With Fibr, businesses can deliver cohesive, on-brand experiences at scale, streamline content creation, and achieve superior marketing results. By leveraging Fibr’s AI-driven personalization, companies can navigate the challenges of a cookie-less future and drive down CAC, making their marketing efforts more efficient and impactful.",Fibr is an AI-powered personalization platform that helps brands improve conversion rates.,"Accel, Kunal Shah, Sprint Vc, 2am VC",Seed,"$1,800,000",11-50,"Dover, Delaware, United States","Dec 28, 2022"
Turnkey,"Blockchain, Cryptocurrency, Cyber Security",Turnkey is a provider of scalable wallet infrastructure for crypto developers to manage private keys. Its product suite enables developers to build anything that involves a wallet or cryptographic transaction to generate and manage private keys across blockchains without compromising on security.,Turnkey is a private key infrastructure provider that offers secure APIs to manage private keys.,"Sequoia Capital, Gemini, Alchemy",Series A,"$15,000,000",11-50,"New York, New York, United States",2022
Proof of Play,"Blockchain, Gaming, Virtual Reality","Proof of Play creates games that are defining for a generation because they essentially give players control and ownership. The company was founded in 2022 and is based in New York, New York, USA.",Proof of Play creates games that are defining for a generation because they essentially give players control and ownership.,"Andreessen Horowitz, Greenoaks",Seed,"$33,000,000",1-10,"New York, New York, United States",2022
Moment,"Analytics, Financial Services, FinTech","Moment is an operator of a fixed-income infrastructure for modern firms. The company's goal is to deliver modern fixed-income solutions to global fintechs, traditional brokerages, and registered investment advisors to make markets more equitable and accessible.",Moment is an operator of a fixed-income infrastructure for modern firms.,"Andreessen Horowitz, Evolution Ventures",Series A,"$17,000,000",1-10,"New York, New York, United States",2022
Together AI,"Artificial Intelligence (AI), Generative AI","Together AI is a cloud-based platform designed for constructing open-source generative AI and infrastructure for developing AI models. The company contributes cutting-edge open-source research, models, and datasets to push the boundaries of AI forward. Through its decentralized cloud services, developers and researchers at organizations of various scales are empowered to train, refine, and deploy generative AI models.",Together AI is a cloud-based platform designed for constructing open-source generative AI and infrastructure for developing AI models.,"NVIDIA, First Round Capital, Robot Ventures",Series A,"$106,000,000",11-50,"San Francisco, California, United States","Jun 11, 2022"
Alison AI,"Artificial Intelligence (AI), Enterprise Software","Alison is the world's best AI-powered creative (Video) Analysis platform. From ideation to optimization to production, Alison makes it easier than ever to create Videos with the highest likelihood of success. Our unique SaaS technology allows businesses to identify their top-performing elements in creatives, get full-funnel data, and perform intelligent competitive analysis. Stop the guesswork and start making results-driven creatives!",Alison.ai is the world's best AI-powered creative (Video) Analysis platform.,"Andreessen Horowitz, Cardumen Capital",Pre-Seed,"$5,100,000",11-50,"Tel Aviv-yafo, Tel Aviv, Israel",Jan 2022
Spruce,"Analytics, Blockchain, Cryptocurrency",Spruce is building a future where users control their identity and data across all digital interactions.,Spruce is building a future where users control their identity and data across all digital interactions.,"Techstars, Andreessen Horowitz",Series A,"$34,000,000",11-50,"New York, New York, United States","May 13, 2020"
Optimizer AI,"Artificial Intelligence (AI), Information Technology",Optimizer AI creates AI technology to swiftly and simply generate resources required for game and content development.,Optimizer AI creates AI technology to swiftly and simply generate resources required for game and content development.,"Andreessen Horowitz, Krew Capital",Pre-Seed,"₩1,000,000,000",1-10,"San Francisco, California, United States",Jul 2023
Bold,"Fitness, Health Care, Wellness","Bold is an at-home digital fitness program designed to help older adults live their strongest, happiest, and healthiest lives. As a member, you’ll enjoy instant access to expert trainers, scientific assessments, and personalized workout plans to help you improve your strength, flexibility, and balance — so you can chase the life you want, at any age.","Empowering exercise programs designed just for you, so you can chase the life you want at any age.","Khosla Ventures, Andreessen Horowitz",Series A,"$17,000,000",11-50,"San Mateo, California, United States",2020
Stonks,"Finance, Financial Services, FinTech","Stonks develops a crowdfunding platform for startups and small businesses. Users of the portal can find startups supported by VCs, angel investors, and accelerators.",Stonks develops a crowdfunding platform for startups and small businesses.,"Andreessen Horowitz, 500 Global",Seed,—,11-50,"San Francisco, California, United States",2020
LangChain,"Artificial Intelligence (AI), Database","LangChain is a language model application development library that develops a language model framework to power applications that integrate with other sources of data and interact with their environment. Its platform also offers support for various model types, prompt management, memory, indexing, chains, and agents to help developers create generative artificial intelligence like personal assistants, question-answering bots, chatbots, and data querying.",LangChain enables developers to accelerate their LLM application workflows by overseeing the entire project lifecycle.,"Sequoia Capital, Benchmark",Series A,"$25,000,000",11-50,"San Francisco, California, United States",2022
Metaphor,"Analytics, Artificial Intelligence (AI)","Metaphor is a search and discovery tool built for data scientists, data engineers, and AI practitioners. It aims to help all organizations better understand and manage their data through the power of the metadata knowledge graph.","Metaphor is a search and discovery tool built for data scientists, data engineers, and AI practitioners.","Andreessen Horowitz, Point72 Ventures",Seed,"$5,000,000",11-50,"San Francisco, California, United States",Oct 2020
Cosmos,"Artificial Intelligence (AI), Content","Cosmos is a Pinterest alternative for creatives. Save anything on the web, curate into clusters, and share with the world.",Cosmos is a Pinterest alternative for creatives.,"Accel, Google Ventures",Seed,"$6,000,000",1-10,"New York, New York, United States",2021
Locofy,"Artificial Intelligence (AI), Enterprise Software","Locofy provides a service that converts designs into code. Locofy.ai aims to take away the menial work of engineers without adding complexity i.e. automating 50% or more of the current workflow starting with frontend code, allowing teams to convert their designs to code and an interactive and responsive live prototype (that runs on code), without writing a single line of code.",Locofy provides a service that converts designs into code.,"Accel, Golden Gate Ventures, January Capital",Pre-Seed,"$4,250,000",11-50,"Singapore, Central Region, Singapore",2021
Rhythms,"Artificial Intelligence (AI), Internet","Rhythms offers generative AI, the prevalence of hybrid workplaces, the imperative to do more with less are reshaping organizations function.","Rhythms offers generative AI, the prevalence of hybrid workplaces, the imperative to do more with less are reshaping organizations function.","Greenoaks, Accel, Madrona, Cercano Management",Seed,"$26,000,000",1-10,"Bellevue, Washington, United States",2023
Vesta,"Financial Services, FinTech, Software","Vesta provides next-generation LOS that enables lenders across the board to build customized workflows that enable a more efficient, easy-to-use, and expedient lending process.",Vesta is building the next generation loan origination system.,"Andreessen Horowitz, Index Ventures",Series A,"$30,000,000",11-50,"San Francisco, California, United States",2020
Poggio Labs,"Analytics, Cloud Data Services","Poggio Labs develops customer data applications. It was founded in 2021 and is headquartered in San Francisco, California.",Poggio Labs develops customer data applications.,"Accel, Spark Capital, Mischief",Seed,"$6,000,000",11-50,"San Francisco, California, United States",2021
Wizard,"Artificial Intelligence (AI), E-Commerce",Wizard operates a commerce technology startup to transform e-commerce with conversational AI. The company was founded in 2021 and is headquartered in New York.,Wizard operates a commerce technology startup to transform e-commerce with conversational AI.,"Accel, New Enterprise Associates",Series A,"$50,000,000",11-50,"New York, New York, United States","Sep 1, 2021"
APEX,"Artificial Intelligence (AI), Computer",APEX is an AI security company that provides organizations to get visibility of GenAI activity and much needed security platform.,APEX is a AI security company that provides organizations to get visibility of GenAI activity.,"Sequoia Capital, Index Ventures",Seed,"$7,000,000",11-50,"Tel Aviv, Tel Aviv, Israel",2023
Xaver,"Asset Management, Banking","Xaver enables Financial Institutions to close Europe’s pension gap. By offering an advanced AI-driven B2B platform for life insurance and private pension sales, Xaver enhances the operational and sales efficiency of banks, insurers, and brokers by up to 65% and introduces a new era of white-labeled private pension products. With a leadership team of experienced industry veterans - Max Bachem, Ole Breulmann, and Dr. Björn Holste - and backing from leading VC funds and a prominent group of former financial institution executives, fintech pioneers, and unicorn founders, Xaver is dedicated to improving the pension situation of Europeans through their B2B offering.",Xaver combines personalised digital funnels with AI-assisted personal customer interactions to forge a seamless omni-channel experience.,"Sequoia Capital, Notion Capital",Pre-Seed,"€5,690,000",11-50,"Köln, Nordrhein-Westfalen, Germany","Jun 7, 2023"
MedScout,"Health Care, Medical, Sales, Software",MedScout is a revenue acceleration platform for medical device and diagnostic companies. MedScout combines the most recent medical claims intelligence from public and private payors with an easy-to-use user interface designed specifically for sales professionals and leaders at growing medical device and diagnostic companies. MedScout provides clients with immediate insight into the addressable market within their current territories and enables them to easily understand the implications of any changes.,MedScout is a revenue acceleration platform for medical device and diagnostic companies.,"Andreessen Horowitz, Alumni Ventures",Series A,"$15,000,000",11-50,"Austin, Texas, United States",2021
Flexpa,"Developer APIs, FinTech, Health Care","Flexpa allows digital health apps to connect to new patient access APIs. Flexpa develops an API to integrate claims histories into any digital health or fintech app. The company was founded in 2021 and is located in San Francisco, California.",Flexpa allows digital health apps to connect to new patient access APIs.,"Andreessen Horowitz, General Catalyst",Seed,"$8,500,000",11-50,"San Francisco, California, United States",2021
Ex-human,"Artificial Intelligence (AI), Chatbot","Ex-human creates customizable AI Humans for engaging conversations. We offer hyper-realistic AI characters, enhancing user engagement for entertainment companies, including Gaming, Dating, Chatbots, and Virtual Influencers.","Platform for AI Humans for immersive conversations. Our hyper-realistic characters boost engagement for games, datings and influencers.","Andreessen Horowitz, Soma Capital",Seed,"$800,000",11-50,"San Francisco, California, United States",May 2021
Optic,"Blockchain, Information Technology","Optic, an AI Drug Discovery company, based in San Francisco. Our proprietary a ligand-based and target-driven molecular search engine Bioptic.io identifies compounds by their activity-expressing fingerprints. It offering a novel approach to finding diverse set candidates. Our pipeline includes multiple pre-clinical stage programs, showcasing our commitment to practical, AI-driven solutions in cancer therapy.","AI-powered drug discovery platform for rapid molecule screening and testing, from target identification to lab validation.","Circle, CoinDCX, OpenSea, Polygon",Seed,"$11,000,000",11-50,"San Francisco, California, United States",Mar 2020
Mindy,"Generative AI, Search Engine",Mindy provides tangible value to your current communication channels. It can communicate with you via email and helps you with tasks ranging from conducting research for a paper to scheduling virtual meetings and planning your next vacation.,Mindy provides tangible value to your current communication channels.,Sequoia Capital,Seed,"$6,000,000",1-10,"San Francisco, California, United States",2023
Rezo Therapeutics,"Artificial Intelligence (AI), Biotechnology","Rezo Therapeutics identifies targets and therapies by combining distinct, unbiased technologies with artificial intelligence. Rezo's proprietary platform can be used to treat a wide range of diseases. Rezo's initial focus is oncology, with plans to expand into other therapeutic areas through collaborations and partnerships.","Rezo Therapeutics identifies targets and therapies by combining distinct, unbiased technologies with artificial intelligence.","Eli Lilly, Andreessen Horowitz",Series A,"$78,000,000",1-10,"South San Francisco, California",2021
RapidCanvas,"Artificial Intelligence (AI), Generative AI","RapidCanvas is the AI platform for business users. With RapidCanvas, organizations can develop bespoke high-performance, production-grade AI solutions 10x faster, all without the need for specialized data science knowledge or coding expertise, or any investments in professional services. Leveraging cutting-edge AutoAI technology, RapidCanvas effortlessly navigates users through an automated journey from raw data to explainable and actionable predictions. RapidCanvas works with industry leaders in manufacturing, direct-to-consumer, real estate, and financial services, empowering them to unlock the full potential of AI. For more information visit rapidcanvas.ai.","RapidCanvas is the AI platform for business users. It takes one week to get an AI POC, one month to get an AI solution. Or your money back.","Accel, Valley Capital Partners",Seed,"$7,500,000",11-50,"Austin, Texas, United States",2021
Mira,"Artificial Intelligence (AI), Information Technology",Mira is a decentralized infrastructure platform designed to increase access to advanced AI.,Mira is a decentralized infrastructure platform designed to increase access to advanced AI.,"BITKRAFT Ventures, Accel, Sandeep Nailwal",Seed,"$9,000,000",11-50,—,2024
Thatch,Health Care,Thatch helps businesses give great healthcare to their employees.,Thatch helps startups give great healthcare to their teams.,"Andreessen Horowitz, General Catalyst",Series A,"$38,000,000",11-50,"San Francisco, California, United States",Oct 2021
Base64.ai,"Artificial Intelligence (AI), Document Management","Base64.ai automates all document processes using Generative AI and Large Language Models. The startup is disrupting the $100 billion Intelligent Document Processing market with its unique capability to understand any document without training. It has four patent applications, supports over 2,800 document types, and has 400+ no-code integrations. It's at $1.2m GAAP ARR with 1.5x growth in the last three months. The startup was funded $2m in Q2 2022 by Long Journey Ventures, Prime Zero, and Sequoia Scout. The founder, Ozan Bilgen, was a software engineer/manager at Microsoft, Netflix, PayPal, Uber, and Palantir.",Intelligent document processing,"Sequoia Capital, Long Journey Ventures",Seed,"$3,720,000",11-50,"New York, New York, United States","Jan 15, 2020"
StackOne,"Data Integration, Developer APIs","StackOne allows you to build Integrations, easier, faster, and safer, enabling you to focus on your core product development, while effortlessly adding connectors to your customers' tools within your SaaS platform.","iPaaS with Unified API for HRIS, ATS, CRM, ESPs and more","Sequoia Capital, Playfair Capital",Seed,"€3,300,000",11-50,"London, England, United Kingdom",2023
HumanX,"Artificial Intelligence (AI), Software",HumanX focuses on AI serves as a catalyst for enterprises to identify realistic solutions in the rapidly changing AI field.,HumanX focuses on AI serves as a catalyst for enterprises.,"Andreessen Horowitz, Primary Venture Partners",Seed,"$6,000,000",11-50,"Las Vegas, Nevada, United States",2023
Patina,"Health Care, Primary and Urgent Care",We believe everyone should have the opportunity to live their best lives and age with dignity. That’s why we’re reinventing primary care with an approach designed to profoundly improve the healthcare and aging experience for older adults and their loved ones.,Patina is reinventing primary care for adults 65+ so everyone gets the healthcare and aging experience they deserve.,"Andreessen Horowitz, Google Ventures",Series A,"$50,000,000",11-50,"Philadelphia, Pennsylvania, United States",2020
Fortuna Health,"Health Care, Information Technology",Fortuna Health offers healthcare via navigating Medicaid.,"Fortuna streamlines Medicaid navigation for consumers, covering eligibility, enrollment, and renewal processes seamlessly.","Andreessen Horowitz, Y Combinator",Seed,"$4,000,000",1-10,"New York, New York, United States",2023
Distributional,"A/B Testing, Artificial Intelligence (AI)","Distributional makes AI safe, reliable and secure.","Distributional makes AI safe, reliable and secure.","Andreessen Horowitz, Point72 Ventures",Seed,"$11,000,000",1-10,"Berkeley, California, United States",2023
Topography Health,"Clinical Trials, Consulting, Health Care","Topography Health encourages physicians in private practice to participate in clinical trials in order to advance medical research. Topography assists medical practices in better understanding their patient populations, recommending which studies are likely to be taken up and have an impact, recruiting patients, and hiring and managing research staff. Topography-powered local clinical trials give patients with a wide range of health conditions access to personalized clinical trials for the first time.",Topography Health encourages physicians in private practice to participate in clinical trials in order to advance medical research.,"Andreessen Horowitz, FJ Labs",Series A,"$21,500,000",11-50,"Wilmington, North Carolina, United States",2020
Super Payments,"Financial Services, FinTech, Payments","Super Payments aims to transform the online shopping experience powering free payments for businesses, and rewarding shopping for members. Businesses on Super will only pay a commission if it results in an increase in sales, as opposed to charging merchants transaction fees.",Super Payments is a fintech that disrupts the industry behemoths Visa and MasterCard.,"Accel, Union Square Ventures",Pre-Seed,"$30,000,000",11-50,"London, England, United Kingdom","Feb 9, 2022"
Pace,"Health Care, Mental Health, mHealth",Pace is a mental fitness and social wellness platform that aims to help people connect emotionally with themselves and others. It collaborates with skilled mental health professionals to reimagine group connection and support.,"Pace provides online peer support groups to give and receive support, therapy for diagnosed conditions like addiction or depression.","Sequoia Capital, SV Angel, BoxGroup",Series A,"$13,000,000",11-50,"California City, California, United States",2020
PROOF,"Art, Blockchain, Communities","PROOF is a podcast that provides in-depth non-fungible token coverage. They interview NFT artists, both new and seasoned. They also explore the generative art scene, the NFT gaming/metaverse, and entrepreneurs who are creating new tools for creators and collectors.",PROOF is a podcast that provides in-depth non-fungible token coverage.,"Andreessen Horowitz, SV Angel",Series A,"$50,000,000",11-50,"Portland, Oregon, United States",2021
Meeno,"Artificial Intelligence (AI), Information Technology",Meeno offers an AI relationship mentoring app targeting young adults. It provides tailored coaching exercises that are mostly created and selected for Gen Z. It is structured as a vertical AI product.,Meeno offers an AI relationship mentoring app targeting young adults.,"Sequoia Capital, New Enterprise Associates",Seed,"$3,900,000",1-10,"San Francisco, California, United States",2023
FlyFin AI,"Financial Services, FinTech",FlyFin is a consumer startup that focuses on automating financial lives. A.I. scans for all possible tax deductions and simply connects all expense accounts & FlyFin eliminates 98% of the work.,FlyFin is a consumer startup that focuses on automating the financial lives.,"Accel, Alpha Wave Global",Seed,"$8,000,000",1-10,"San Jose, California, United States",2020
Valora,"Blockchain, Financial Services","Valora is a mobile crypto wallet that combines the power of blockchain and mobile with an intuitive user interface to make crypto easy to use. Valora makes crypto useful and accessible even on the most basic smartphones, enabling 6 billion smartphone users worldwide to reliably save, send, and spend crypto as easily as sending a text message.","Valora is a mobile wallet that allows you to send, save, and spend crypto as easily as sending a text","Andreessen Horowitz, Polychain",Series A,"$20,000,000",11-50,"San Francisco, California, United States",Feb 2021
Lit Protocol,"Blockchain, Content, Software",Lit Protocol is a decentralized access control infrastructure designed to bring more utility to the web.,Lit Protocol is decentralized access control infrastructure designed to bring more utility to the web.,"LongHash Ventures, Figment",Series A,"$13,000,000",11-50,"San Francisco, California, United States",2021
Prophetic,"Artificial Intelligence (AI), Medical Device",Prophetic AI is a non-invasive neurotech company that offers neural devices to help people stabilize and induce lucid dreaming.,Prophetic is a non-invasive neurotech company that offers neural devices to help people stabilize and induce lucid dreaming.,"Andreessen Horowitz, BoxGroup",Seed,"$1,100,000",1-10,"New York, New York, United States",2023
Aquarium,"Analytics, Artificial Intelligence (AI)","Aquarium Learning is an ML data management platform that helps to improve models by improving datasets. The company was founded in 202 and based in San Francisco, California.",Aquarium is expertise in making machine learning accessible to its customers that helps to simplify their models by improving datasets.,"Sequoia Capital, Y Combinator",Seed,"$2,600,000",11-50,"San Francisco, California, United States",2020
Setter,"Blockchain, Cryptocurrency, Ethereum",Setter is a smart contract wallet that invites mainstream users into the fold and bridges the gap between web2-to-web3 commerce with ease.,Setter is a smart contract wallet that invites mainstream users into the fold and bridges the gap between web2-to-web3 commerce with ease.,"Andreessen Horowitz, Dreamers VC",Seed,"$5,000,000",1-10,"Chicago, Illinois, United States",Sep 2021
Linera,"Software, Web3","Linera is the power of decentralization for everyone, everywhere.",Linera is a multi-chain infrastructure designed for highly scalable web3 applications.,"Andreessen Horowitz, Borderless Capital",Seed,"$6,000,000",1-10,"Menlo Park, California, United States",2021
Atlantic Money,"Apps, Finance, Financial Services","Atlantic Money is a money transfer provider that offers international transactions for a flat fixed fee of £3 or €3 at the current exchange rate. All the way up to £1m or €1m. Atlantic Money is a international player in payment services that offers the world's cheapest solution for money transfers in foreign currencies. Atlantic Money was established in 2020 in London, England.",Send money abroad – always at the live exchange rate for just a flat £/€3 fee. All the way up to £/€1 million.,"Index Ventures, Susa Ventures",Seed,"$3,000,000",11-50,"London, England, United Kingdom",2020
