Name,Market Size,Innovation Level,Market Competition,User Fit,Industry Relevance,Team Size and Traction,Funding and Validation
11x,"The market for digital process automation, especially using AI to streamline business operations, is large and continues to expand. The demand for optimization of GTM processes is significant as more businesses seek cost-effective strategies to improve efficiency.","The startup demonstrates disruptive innovation by developing autonomous digital workers—a novel application of AI in sales and business operations, addressing specific and unmet needs in efficient process management.","The market for AI-driven automation is moderately competitive. While there are established players, the niche focus on autonomous digital workers for GTM operations provides room for new entrants to offer differentiated solutions.","The user's expertise in AI, solution architecture, data, and tech strategy directly aligns with the startup’s focus on AI-driven automation, indicating a high potential for the user to contribute significantly to the startup's growth and success.","The AI and digital workforce industry is extremely relevant, experiencing exponential growth with widespread interest. It is poised to have a major impact on the global market, transforming traditional work processes.","With a team size of 11-50 and the company being founded just over a year ago, 11x demonstrates early traction fitting a medium-sized startup. It shows promise in building its team and gaining market attention quickly but is still solidifying its market position.",Achieving Series A funding of $24 million within a year of founding indicates strong investor confidence and substantial validation for a startup of its age. This level of investment is indicative of potential for rapid growth and expansion.
Tennr,"The healthcare industry, particularly digital health technologies like AI solutions, is a very large and rapidly expanding market. The increasing demand for efficient healthcare operations and cost reduction presents substantial growth opportunities for companies that can effectively leverage AI technologies to innovate in this space.","Tennr is leveraging AI technology to transform traditional healthcare operations such as communication and data handling, which represents a disruptive innovation in addressing unmet needs for efficiency in the healthcare sector. While it is highly innovative, healthcare AI optimization still operates within an existing technological framework, hence not reaching a full score for exploring new technological frontiers.","The healthcare technology market is moderately competitive, with various competitors focusing on automating and optimizing healthcare operations. However, Tennr's specific focus on AI-driven communications and operations might still provide room for differentiation and growth.","The user's expertise in AI, solution architecture, data, and technology strategy aligns highly with Tennr's focus on leveraging AI for healthcare operations. This background can significantly contribute to the startup's success, positioning the user as a key asset for growth and innovation within Tennr.","The healthcare industry is extremely relevant globally, with exponential growth projected due to technological advancements and the increasing need for efficient, cost-effective healthcare delivery. Tennr operates within this impactful sector, maximizing its potential to contribute to and benefit from this global trend.","With a medium-sized team of 11-50 employees, founded in 2021, Tennr shows some market traction and steady growth in a relatively short time since its inception. However, the team size and timeframe suggest they are still establishing their presence and market validation.","Tennr has completed a Series A funding round, raising $18,000,000, which indicates growing investor confidence and validation. For a company founded in 2021, achieving this level of funding within two years is a positive sign, but it is typical for emergent tech startups at this stage and age."
Sahara AI,"Sahara AI operates within the AI market, which is very large and rapidly expanding, particularly in areas focusing on decentralized and privacy-focused solutions. The demand for AI solutions that can be deployed autonomously and securely is substantial, indicating significant growth opportunities.","The startup offers disruptive innovation by allowing decentralized deployment of AI with a privacy-first approach. This addresses the unmet need for high-performance AI networks that prioritize user privacy, making it highly innovative, although the concepts of autonomy and privacy are being explored by a few other companies.","The market for AI networks, especially decentralized, is moderately competitive. While the demand is high, there are several players already establishing themselves. However, the unique focus on privacy and autonomous deployment may provide some differentiation.","Given the user's expertise in AI, solution architecture, data, and tech strategy, they can be a key asset. They can contribute significantly to strategically guiding the company's AI and data-centric solutions, thereby facilitating growth and success.","AI is an extremely relevant industry, often considered the backbone of technological advancements with exponential growth and significant future impact anticipated globally. The focus on decentralized and privacy-centric networks adds further relevance.","With a medium-sized team founded in 2023, the company shows some market traction likely due to strategic developments and its Series A funding. The size and age of the venture align with a steady but promising growth trajectory, considering their recent establishment.","Securing $37,000,000 in a Series A round from prestigious investors such as Sequoia Capital and Polychain suggests growing investor confidence. It's substantial for a company founded in 2023, indicating healthy potential for additional growth phases given their young age."
HeyGen,"The market for AI-driven video content creation is large and growing. As businesses increasingly use video for marketing, communication, and training, solutions that simplify video production hold significant potential. However, with rapid growth, some market segments might be saturated.","Movio's innovation lies in automating video creation by transforming text into realistic spokesperson videos, addressing unmet needs for quick and accessible video content generation. This represents disruptive innovation by eliminating traditional barriers like actors and cameras.","The market is moderately competitive with established players in AI and video creation tools, such as platforms focusing on template-based or automated video editing. Movio's unique proposition differentiates it, but it competes in a space where new entrants regularly emerge.","The user's expertise in AI, solution architecture, data, and tech strategy aligns closely with Movio's technical needs, suggesting a significant potential for contribution to the startup's innovation, scalability, and strategic direction.","The industry of AI-driven content creation is highly relevant, with exponential growth expected due to the rising demand for digital content and the shift towards automated solutions in media and business communication.","Movio has 11-50 employees and was founded in 2020, indicating a medium-sized team with early traction. The team size suggests steady but not yet exponential growth, which is reasonable given the company's age.","Movio's Series A funding amounting to $60,000,000 and investment from prominent investors like Thrive Capital and Benchmark reflect strong investor confidence and significant validation, particularly impressive for a company founded in late 2020."
Nurix AI,"Nurix AI operates within the AI and data integrity domain, which is a large and growing market. With the increasing reliance on AI solutions across various industries, the demand for high-quality data is significant. The market offers good growth potential as businesses seek to leverage data-driven insights to enhance their operations.","The startup is enhancing data quality and integrity within the realm of generative AI, which reflects significant innovation in the mature AI sector. While this is not a completely new technological frontier, improving data integrity represents a critical advancement necessary for more accurate and reliable AI outcomes.","The AI and data management markets are moderately competitive, with multiple established and emerging players. However, there is room for new entrants who can deliver unique value propositions and effectively address specific niches within the broader market.","The user’s expertise in AI, solution architecture, data, and technology strategy aligns strongly with the core focus areas of Nurix AI. They can contribute significantly to the startup's success by leveraging their skills to enhance product development, strategic planning, and technical execution.","The industry is extremely relevant, given the rapid development of AI technologies and their growing integration across sectors such as healthcare, finance, and technology. This relevance is underscored by the critical role data quality plays in ensuring the effectiveness and reliability of AI systems globally.","With a team size of 11-50 and having been founded in 2024, Nurix AI shows early traction and promise. The team size indicates they are still in the early stages of growth, working on validating their product and capturing market opportunities.","The startup has raised a Series A round of $15 million, which indicates growing investor confidence and validation. Given that the company was founded in 2024, securing this level of funding is reasonable, showing they have caught the attention of reputable investors like General Catalyst and Accel. Further validation could be achieved in subsequent funding rounds as they continue to scale."
e6data,"The market for high-performance data analytics engines is large and growing. Many enterprises are increasingly investing in big data and business intelligence, offering good growth potential despite some level of existing market saturation.","The startup addresses unmet needs by offering a next-generation compute engine that significantly boosts performance and reduces costs. While data analytics and lakehouse solutions are established, the claimed innovation of a five-fold performance increase is disruptive in this mature industry.","The market for data analytics engines is moderately competitive with established players such as Snowflake, Databricks, and others. However, e6data's ability to integrate with existing lakehouse formats and avoid lock-in presents a differentiation opportunity, allowing room for new entrants.","The user's expertise in AI, solution architecture, data, and tech strategy is highly relevant to the startup's industry. They can be a key asset for growth by leveraging their skills to optimize the compute engine and contribute to the data and tech strategy.","The data analytics industry is extremely relevant, experiencing exponential growth and expected to significantly impact the global market. There is widespread interest in maximizing data value and performance, further increasing its relevance.","With a team size of 11-50 and founded in 2020, the startup shows some market traction and steady growth. While larger than typical early-phase startups, it is still in the growth stage, with potential for acceleration.",Having raised $10 million in a Series A round by reputable investors such as Accel suggests growing validation and confidence from investors. This funding level is reasonable for a company founded in 2020 and indicates potential for further growth.
Ideogram,"The market for AI-driven generative technologies, particularly in text-to-image applications, is vast and rapidly expanding. With applications in various sectors such as entertainment, marketing, and content creation, there is substantial growth potential as businesses increasingly seek AI solutions to enhance creativity and efficiency.","Ideogram's focus on generative text-to-image technology suggests a highly innovative approach that can address unmet needs by enabling unique and automated content creation. While not entirely novel, as similar technologies exist, their approach could disrupt traditional image generation methods, making it a significant player in the industry.","The field of generative AI is highly competitive with several well-established players like OpenAI and Midjourney. Consequently, while new entrants can carve out a niche, they face high barriers due to existing competitive pressures and the need for differentiation.","The user has expertise in AI, solution architecture, data, and tech strategy—highly relevant areas for Ideogram. This alignment allows the user to significantly contribute to the startup by implementing sophisticated AI solutions, designing efficient system architectures, and driving strategic tech growth.","The AI industry, particularly in innovation areas like generative text-to-image applications, is highly relevant and expected to have a profound global impact. With exponential growth and increasing adoption across industries, it holds immense potential for future advances and applications.","With a small team (1-10 employees) founded very recently in 2022, Ideogram is in the early stages of development and validation. Although they have secured significant funding indicating initial traction, the small team size points to early-phase operations and product-market fit exploration.","Ideogram has recently completed a Series A funding round, raising CA$80,000,000 with backing from notable investors like Andreessen Horowitz and Index Ventures. For a startup founded in 2022, this substantial funding signifies strong investor confidence and indicates rapid growth potential, validating the company's business model and market prospects."
Anysphere,"Artificial Intelligence (AI) represents a very large and rapidly expanding market with substantial growth opportunities. This space is experiencing significant investments and adoption across multiple industries, from healthcare to finance, indicating immense potential for companies operating in this domain.","Anysphere's focus on building AI tools and assistants suggests a disruptive innovation model, addressing unmet needs in automating and augmenting human tasks. While there are existing AI solutions, the company's specific approach could offer unique features or performance enhancements, positioning it as an innovative player.","The AI tools and assistants market is highly competitive, with numerous established companies, including tech giants like Google, Microsoft, and Amazon. Many startups are also entering the space, and differentiation is key to gaining a foothold amidst substantial competition.","The user's expertise in AI, solution architecture, data, and tech strategy is highly relevant to Anysphere's focus. The user can significantly contribute to the startup's success by leveraging their skills to enhance AI tool development, optimize data strategies, and guide tech-driven initiatives.","The AI industry is extremely relevant, showing exponential growth and anticipated to have a major global impact. AI technologies are increasingly integrated into diverse applications, driving innovation, efficiency, and transformation across multiple sectors.","With a small team of 1-10 employees founded in January 2022, Anysphere is still in its early stages, showing initial traction. The company is actively building its product and validating market fit, but has not yet demonstrated significant team expansion or established traction in the market.","Raising $60,000,000 in a Series A round from top investors like Andreessen Horowitz and Thrive Capital indicates high investor validation and substantial funding efficacy for a company founded within the last two years. This level of investment at an early stage is indicative of strong market potential and confidence in the company's growth prospects."
Skild AI,"The robotics market, especially involving AI-powered solutions, is a large and growing market. With advancements in AI and robotics, there is substantial potential for growth and new applications across industries such as manufacturing, logistics, healthcare, and more. The size of the market is significant because the demand for automation and intelligent systems is increasing.","Skild AI is innovating in the domain of robotics, which inherently involves a high level of technological advancement. The development of software to power various types of robots, especially versatile ones like bipedal and quadrupedal models, addresses unmet needs in adaptability and mobility in robotics. This demonstrates a level of disruptive innovation, particularly if it involves novel applications or improvements in AI-driven robot autonomy.","The robotics industry is moderately competitive with numerous players ranging from startups to established companies in tech and manufacturing sectors. While there is room for new entrants, gaining a significant foothold against established players may be challenging depending on specific submarkets. Skild AI's investment from major tech firms suggests it has competitive strengths or unique offerings.","The user's expertise in AI, solution architecture, data, and tech strategy is highly relevant to Skild AI's focus on developing software for robotics. Such expertise can significantly contribute to enhancing the product offering, optimizing technology strategy, and shaping the company’s growth direction. This aligns perfectly with the company's needs, making the user a key asset.","Robotics is at the forefront of technological advancement and is considered extremely relevant in today’s global market. It is anticipated to have a transformative impact on numerous industries by improving efficiency, safety, and capabilities. The exponential growth potential and investor enthusiasm further underscore its global significance.","Skild AI has a medium-sized team with 11-50 employees and was founded in 2023. The team size, in conjunction with substantial Series A funding, indicates good initial traction and rapid growth potential. This team size suggests the startup is scaling quickly, which is promising for a company that is relatively new to the market.","The company raised $300,000,000 in a Series A round, with notable investors like Amazon and SoftBank involved. This substantial funding, especially significant for a company founded in the same year, demonstrates strong investor confidence and validation. The amount indicates ambitious growth plans and potential for significant market impact, typical of companies in expansion phases (Series B/C typically)."
Farcaster,"The social networking sector is a very large, rapidly expanding market. The niche focus on coders, fitness enthusiasts, and meme creators offers substantial growth opportunities as these communities continue to grow globally in interest and activity.","Farcaster aims to create a decentralized social network, addressing unmet needs in privacy and direct communication. This marks disruptive innovation in the social networking space by reducing reliance on proprietary network grids.","The social networking market is highly competitive with established giants like Facebook, Twitter, and LinkedIn. While the decentralized focus provides differentiation, breaking into and capturing significant market share remains challenging.","The user's expertise in AI, solution architecture, data, and tech strategy can significantly contribute to Farcaster's growth. These areas are crucial for optimizing user experiences and enhancing the technological framework of a decentralized network.","Social networking is extremely relevant globally, with continual growth and influence across multiple markets. The shift towards decentralization and privacy further amplifies its significance in the current tech landscape.","With a small team of 1-10 employees founded in 2020, Farcaster is still in the early stages of development and market testing. The small team size suggests that while there may be early traction, the startup is still validating its product and market fit.","Farcaster has completed a Series A funding round with high-profile investors such as Andreessen Horowitz and First Round Capital. This indicates reasonable investor confidence fitting the company's age, though the funding amount of $150,000,000 is notable for a Series A, showing potential for traction and growth expectations."
Function Health,"The health and wellness market, especially concerning advanced lab tests and personalized health monitoring, is substantial and growing. As more individuals seek proactive health management solutions, this market shows good growth potential, although there may be some saturation with established players entering this space.","The approach of offering a comprehensive suite of 120+ advanced lab tests with interpretations by top doctors represents disruptive innovation in personalized medicine. This addresses unmet needs in preventive health care by making complex information accessible to users. However, while innovative, this concept is more about repackaging existing technology and services in a new way rather than groundbreaking new technology.","There is moderate competition in the health technology and diagnostics space, with both traditional health services and new startups providing similar services. However, the emphasis on expert interpretations and comprehensive offerings provides a differentiator, allowing room for new entrants to find their niche.","Given the user’s expertise in AI, solution architecture, data, and tech strategy, they are highly relevant and can be a key asset for growth. The potential for integrating advanced AI and data solutions to enhance diagnostics and personalized recommendations aligns well with the user’s skills, thereby adding substantial value to the startup's operations.","The preventive and personalized health care industry is extremely relevant, experiencing exponential growth due to increasing emphasis on health optimization and chronic disease prevention. This trend is anticipated to have a major global impact as health care shifts towards more personalized, data-driven approaches.","With a medium-sized team of 11-50 employees, founded within the last three years, the startup is in a promising position, showing early traction and steady growth. While the team size indicates potential scalability and market validation, it is still expanding its foothold within the market.","Raising $53,000,000 in a Series A round from top investors such as Andreessen Horowitz and Jeff Dean highlights strong investor confidence and substantial validation, especially for a company founded in 2021. This level of funding and support is indicative of robust growth potential and market acceptance, particularly impressive given the startup's relative newness."
Viggle AI,"The market for AI-driven video content creation tools is large, given the growing demand for digital content across industries such as marketing, education, entertainment, and social media. While there is some saturation with existing solutions, the rapid adoption of AI and video content as a communication medium indicates good growth potential.","Viggle AI offers disruptive innovation by allowing users to create animated videos using simple text input, which addresses an unmet need for accessible animation tools. This technology significantly lowers the barrier for entry into video content production, particularly for individuals without technical or design expertise.","The digital content creation space is competitive, with several established players offering various tools for animation and video production. However, Viggle AI's focus on simplicity and AI-driven innovation provides room for new entrants by differentiating itself from traditional design software.","The user's expertise in AI, solution architecture, data, and tech strategy is highly relevant to Viggle AI's focus on artificial intelligence in animation. This expertise can be a key asset in further developing the product, improving its AI algorithms, and optimizing its technical strategy.","The industry of AI-driven content creation is extremely relevant and experiencing exponential growth, driven by global digital transformation and the increasing importance of visual content in communication. This trend is anticipated to have a significant impact on the global market.","With a team size of 11-50 employees and being founded in 2022, Viggle AI shows some traction and potential for steady growth. The company is relatively new, which suggests it is still in the early stages of building market traction and developing its customer base.","The Series A funding round, with CA$26 million raised, indicates growing investor confidence and validation. This level of funding is reasonable for a company founded in 2022, showing promising investor interest and potential for expansion in the near term."
